,Name,Position,Email,Qualifications,Publications
0,Dr Karthikeya Patil, Professor & HOD, dr.karthikeyapatil@jssuni.edu.in," BDS, MDS Oral Medicine & Radiology", 191
1,Dr Mahima V.Guledgud, Professor, dr.mahimavg@jssuni.edu.in," BDS, MDS Oral Medicine & Radiology", 170
2,Dr Jaishankar H.P, Reader, drjaishankarhp_dch@jssuni.edu.in," BDS, MDS Oral Medicine & Radiology", 31
3,Dr Nagabhushana Doggalli, Reader, dr.nagabhushand@jssuni.edu.in," BDS, MDS Oral Medicine & Radiology", 45
4,Dr Mahesh K.P, Reader, dr.kpmahesh@jssuni.edu.in," BDS, MDS Oral Medicine & Radiology", 20
5,Dr Sanjay C.J, Reader, drsanjaycj_dch@jssuni.edu.in," BDS, MDS Oral Medicine & Radiology", 30
6,Dr Prasanna Srinivas Deshpande, Lecturer, dr.prasannasrinivasdeshpande@jssuni.edu.in," BDS, MDS Oral Medicine & Radiology", 19
